[
  {
    "id": "basics_greetings_beginner",
    "locale": "pt-BR",
    "categoryId": "basics_greetings",
    "title": "Basics & Greetings beginner",
    "difficultyBand": "beginner",
    "targetPhonemeIds": [],
    "promptIds": [
      "basic_001",
      "basic_002",
      "basic_003",
      "basic_004",
      "basic_005",
      "basic_006",
      "basic_007",
      "basic_009",
      "basic_010",
      "basic_012",
      "basic_013",
      "basic_014"
    ],
    "progressionOrder": 0
  },
  {
    "id": "basics_greetings_intermediate",
    "locale": "pt-BR",
    "categoryId": "basics_greetings",
    "title": "Basics & Greetings intermediate",
    "difficultyBand": "intermediate",
    "targetPhonemeIds": [],
    "promptIds": [
      "basic_008",
      "basic_011",
      "basic_015"
    ],
    "progressionOrder": 1
  },
  {
    "id": "basics_greetings_advanced",
    "locale": "pt-BR",
    "categoryId": "basics_greetings",
    "title": "Basics & Greetings advanced",
    "difficultyBand": "advanced",
    "targetPhonemeIds": [],
    "promptIds": [],
    "progressionOrder": 2
  },
  {
    "id": "body_beginner",
    "locale": "pt-BR",
    "categoryId": "body",
    "title": "Body beginner",
    "difficultyBand": "beginner",
    "targetPhonemeIds": [],
    "promptIds": [
      "body_001",
      "body_003",
      "body_004"
    ],
    "progressionOrder": 10
  },
  {
    "id": "body_intermediate",
    "locale": "pt-BR",
    "categoryId": "body",
    "title": "Body intermediate",
    "difficultyBand": "intermediate",
    "targetPhonemeIds": [],
    "promptIds": [
      "body_002",
      "body_005"
    ],
    "progressionOrder": 11
  },
  {
    "id": "body_advanced",
    "locale": "pt-BR",
    "categoryId": "body",
    "title": "Body advanced",
    "difficultyBand": "advanced",
    "targetPhonemeIds": [],
    "promptIds": [],
    "progressionOrder": 12
  },
  {
    "id": "clothing_beginner",
    "locale": "pt-BR",
    "categoryId": "clothing",
    "title": "Clothing beginner",
    "difficultyBand": "beginner",
    "targetPhonemeIds": [],
    "promptIds": [
      "cloth_001",
      "cloth_002",
      "cloth_003",
      "cloth_005",
      "cloth_006"
    ],
    "progressionOrder": 20
  },
  {
    "id": "clothing_intermediate",
    "locale": "pt-BR",
    "categoryId": "clothing",
    "title": "Clothing intermediate",
    "difficultyBand": "intermediate",
    "targetPhonemeIds": [],
    "promptIds": [
      "cloth_004"
    ],
    "progressionOrder": 21
  },
  {
    "id": "clothing_advanced",
    "locale": "pt-BR",
    "categoryId": "clothing",
    "title": "Clothing advanced",
    "difficultyBand": "advanced",
    "targetPhonemeIds": [],
    "promptIds": [],
    "progressionOrder": 22
  },
  {
    "id": "colors_beginner",
    "locale": "pt-BR",
    "categoryId": "colors",
    "title": "Colors beginner",
    "difficultyBand": "beginner",
    "targetPhonemeIds": [],
    "promptIds": [
      "color_001",
      "color_002",
      "color_004",
      "color_005",
      "color_006",
      "color_007"
    ],
    "progressionOrder": 30
  },
  {
    "id": "colors_intermediate",
    "locale": "pt-BR",
    "categoryId": "colors",
    "title": "Colors intermediate",
    "difficultyBand": "intermediate",
    "targetPhonemeIds": [],
    "promptIds": [
      "color_003"
    ],
    "progressionOrder": 31
  },
  {
    "id": "colors_advanced",
    "locale": "pt-BR",
    "categoryId": "colors",
    "title": "Colors advanced",
    "difficultyBand": "advanced",
    "targetPhonemeIds": [],
    "promptIds": [],
    "progressionOrder": 32
  },
  {
    "id": "common_adjectives_beginner",
    "locale": "pt-BR",
    "categoryId": "common_adjectives",
    "title": "Common Adjectives beginner",
    "difficultyBand": "beginner",
    "targetPhonemeIds": [],
    "promptIds": [
      "adj_001",
      "adj_002",
      "adj_004",
      "adj_005",
      "adj_006",
      "adj_008",
      "adj_009",
      "adj_010",
      "adj_011",
      "adj_012",
      "adj_013",
      "adj_014",
      "adj_015"
    ],
    "progressionOrder": 40
  },
  {
    "id": "common_adjectives_intermediate",
    "locale": "pt-BR",
    "categoryId": "common_adjectives",
    "title": "Common Adjectives intermediate",
    "difficultyBand": "intermediate",
    "targetPhonemeIds": [],
    "promptIds": [
      "adj_003",
      "adj_007"
    ],
    "progressionOrder": 41
  },
  {
    "id": "common_adjectives_advanced",
    "locale": "pt-BR",
    "categoryId": "common_adjectives",
    "title": "Common Adjectives advanced",
    "difficultyBand": "advanced",
    "targetPhonemeIds": [],
    "promptIds": [],
    "progressionOrder": 42
  },
  {
    "id": "core_verbs_beginner",
    "locale": "pt-BR",
    "categoryId": "core_verbs",
    "title": "Core Verbs beginner",
    "difficultyBand": "beginner",
    "targetPhonemeIds": [],
    "promptIds": [
      "verb_001",
      "verb_002",
      "verb_003",
      "verb_004",
      "verb_005",
      "verb_006",
      "verb_007",
      "verb_008",
      "verb_009",
      "verb_010",
      "verb_011",
      "verb_013",
      "verb_014",
      "verb_015",
      "verb_016",
      "verb_017",
      "verb_018",
      "verb_019",
      "verb_020"
    ],
    "progressionOrder": 50
  },
  {
    "id": "core_verbs_intermediate",
    "locale": "pt-BR",
    "categoryId": "core_verbs",
    "title": "Core Verbs intermediate",
    "difficultyBand": "intermediate",
    "targetPhonemeIds": [],
    "promptIds": [
      "verb_012"
    ],
    "progressionOrder": 51
  },
  {
    "id": "core_verbs_advanced",
    "locale": "pt-BR",
    "categoryId": "core_verbs",
    "title": "Core Verbs advanced",
    "difficultyBand": "advanced",
    "targetPhonemeIds": [],
    "promptIds": [],
    "progressionOrder": 52
  },
  {
    "id": "daily_routine_beginner",
    "locale": "pt-BR",
    "categoryId": "daily_routine",
    "title": "Daily Routine beginner",
    "difficultyBand": "beginner",
    "targetPhonemeIds": [],
    "promptIds": [
      "gemini_daily_routine_012",
      "gemini_daily_routine_015",
      "gemini_daily_routine_017",
      "gemini_daily_routine_022",
      "gemini_daily_routine_026",
      "gemini_daily_routine_027",
      "gemini_daily_routine_037",
      "gemini_daily_routine_040",
      "gemini_daily_routine_042",
      "gemini_daily_routine_049",
      "daily_word_006",
      "daily_word_021",
      "daily_word_023",
      "daily_word_029"
    ],
    "progressionOrder": 60
  },
  {
    "id": "daily_routine_intermediate",
    "locale": "pt-BR",
    "categoryId": "daily_routine",
    "title": "Daily Routine intermediate",
    "difficultyBand": "intermediate",
    "targetPhonemeIds": [],
    "promptIds": [
      "gemini_daily_routine_001",
      "gemini_daily_routine_002",
      "gemini_daily_routine_003",
      "gemini_daily_routine_004",
      "gemini_daily_routine_005",
      "gemini_daily_routine_006",
      "gemini_daily_routine_007",
      "gemini_daily_routine_008",
      "gemini_daily_routine_009",
      "gemini_daily_routine_010",
      "gemini_daily_routine_011",
      "gemini_daily_routine_013",
      "gemini_daily_routine_014",
      "gemini_daily_routine_016",
      "gemini_daily_routine_018",
      "gemini_daily_routine_019",
      "gemini_daily_routine_020",
      "gemini_daily_routine_021",
      "gemini_daily_routine_023",
      "gemini_daily_routine_024",
      "gemini_daily_routine_025",
      "gemini_daily_routine_028",
      "gemini_daily_routine_029",
      "gemini_daily_routine_030",
      "gemini_daily_routine_031",
      "gemini_daily_routine_032",
      "gemini_daily_routine_033",
      "gemini_daily_routine_034",
      "gemini_daily_routine_035",
      "gemini_daily_routine_036",
      "gemini_daily_routine_038",
      "gemini_daily_routine_039",
      "gemini_daily_routine_041",
      "gemini_daily_routine_043",
      "gemini_daily_routine_044",
      "gemini_daily_routine_045",
      "gemini_daily_routine_046",
      "gemini_daily_routine_047",
      "gemini_daily_routine_048",
      "gemini_daily_routine_050",
      "daily_word_001",
      "daily_word_002",
      "daily_word_003",
      "daily_word_004",
      "daily_word_005",
      "daily_word_007",
      "daily_word_009",
      "daily_word_010",
      "daily_word_011",
      "daily_word_012",
      "daily_word_013",
      "daily_word_014",
      "daily_word_015",
      "daily_word_016",
      "daily_word_017",
      "daily_word_018",
      "daily_word_019",
      "daily_word_020",
      "daily_word_022",
      "daily_word_024",
      "daily_word_025",
      "daily_word_026",
      "daily_word_027",
      "daily_word_028",
      "daily_word_030"
    ],
    "progressionOrder": 61
  },
  {
    "id": "daily_routine_advanced",
    "locale": "pt-BR",
    "categoryId": "daily_routine",
    "title": "Daily Routine advanced",
    "difficultyBand": "advanced",
    "targetPhonemeIds": [],
    "promptIds": [],
    "progressionOrder": 62
  },
  {
    "id": "directions_beginner",
    "locale": "pt-BR",
    "categoryId": "directions",
    "title": "Directions & Transport beginner",
    "difficultyBand": "beginner",
    "targetPhonemeIds": [],
    "promptIds": [
      "gemini_directions_010",
      "gemini_directions_011",
      "gemini_directions_012",
      "gemini_directions_015",
      "gemini_directions_020",
      "gemini_directions_047"
    ],
    "progressionOrder": 70
  },
  {
    "id": "directions_intermediate",
    "locale": "pt-BR",
    "categoryId": "directions",
    "title": "Directions & Transport intermediate",
    "difficultyBand": "intermediate",
    "targetPhonemeIds": [],
    "promptIds": [
      "gemini_directions_002",
      "gemini_directions_003",
      "gemini_directions_004",
      "gemini_directions_005",
      "gemini_directions_006",
      "gemini_directions_007",
      "gemini_directions_008",
      "gemini_directions_009",
      "gemini_directions_013",
      "gemini_directions_014",
      "gemini_directions_016",
      "gemini_directions_017",
      "gemini_directions_018",